{
  "$schema": "./tick-surveillance-normalization-v1.schema.json",
  "registry_id": "tick-surveillance-normalization-v1",
  "registry_version": "1.0.3",
  "status": "APPROVED",
  "scope": {
    "approved_sources": [
      {"publisher": "CDC ArboNET Tick Module", "dataset_id": "cdc-ixodes-county-status-2025", "source_version": "2025"},
      {"publisher": "CDC ArboNET Tick Module", "dataset_id": "cdc-ixodes-pathogen-status-2025", "source_version": "2025"},
      {"publisher": "NSF NEON", "dataset_id": "DP1.10093.001", "source_version": "RELEASE-2026"},
      {"publisher": "NSF NEON", "dataset_id": "DP1.10092.001", "source_version": "RELEASE-2026"}
    ],
    "non_goals": [
      "A shared collection-method label does not establish scientific comparability, pooling, or representativeness.",
      "No adapter, source acquisition, prevalence calculation, aggregation, or risk methodology is defined here.",
      "Unlisted or changed source values are not guessed; they return an explicit UNKNOWN result."
    ]
  },
  "canonical_values": {
    "tick_taxon": [{"id": "IXODES_SCAPULARIS", "label": "Ixodes scapularis"}, {"id": "IXODES_PACIFICUS", "label": "Ixodes pacificus"}, {"id": "IXODES_SCAPULARIS_OR_PACIFICUS", "label": "Ixodes scapularis or Ixodes pacificus", "aggregate": true}, {"id": "AMBLYOMMA_AMERICANUM", "label": "Amblyomma americanum"}],
    "life_stage": [{"id": "LARVA", "label": "Larva"}, {"id": "NYMPH", "label": "Nymph"}, {"id": "ADULT", "label": "Adult"}, {"id": "MIXED", "label": "Mixed life stage", "aggregate": true}, {"id": "NOT_REPORTED", "label": "Not reported"}],
    "pathogen_target": [{"id": "BORRELIA_BURGDORFERI_SENSU_STRICTO", "label": "Borrelia burgdorferi sensu stricto"}, {"id": "BORRELIA_BURGDORFERI_SENSU_LATO", "label": "Borrelia burgdorferi sensu lato"}, {"id": "BORRELIA_MAYONII", "label": "Borrelia mayonii"}, {"id": "BORRELIA_MIYAMOTOI", "label": "Borrelia miyamotoi"}, {"id": "BORRELIA_SP", "label": "Borrelia sp."}, {"id": "BORRELIA_LONESTARI", "label": "Borrelia lonestari"}, {"id": "ANAPLASMA_PHAGOCYTOPHILUM", "label": "Anaplasma phagocytophilum"}, {"id": "EHRLICHIA_MURIS_EAUCLAIRENSIS", "label": "Ehrlichia muris eauclairensis"}, {"id": "EHRLICHIA_MURIS_LIKE_AGENT", "label": "Ehrlichia muris-like agent"}, {"id": "EHRLICHIA_CHAFFEENSIS", "label": "Ehrlichia chaffeensis"}, {"id": "EHRLICHIA_EWINGII", "label": "Ehrlichia ewingii"}, {"id": "BABESIA_MICROTI", "label": "Babesia microti"}, {"id": "FRANCISELLA_TULARENSIS", "label": "Francisella tularensis"}, {"id": "RICKETTSIA_RICKETTSII", "label": "Rickettsia rickettsii"}, {"id": "POWASSAN_VIRUS", "label": "Powassan virus"}],
    "collection_method": [{"id": "DRAG_CLOTH", "label": "Drag cloth"}, {"id": "FLAG_CLOTH", "label": "Flag cloth"}],
    "effort_unit": [{"id": "SQUARE_METRE", "label": "square metre", "dimension": "AREA"}, {"id": "HECTARE", "label": "hectare", "dimension": "AREA"}],
    "abundance_unit": [{"id": "TICK_COUNT", "label": "ticks", "dimension": "COUNT"}, {"id": "TICKS_PER_SQUARE_METRE", "label": "ticks per square metre", "dimension": "COUNT_PER_AREA"}, {"id": "TICKS_PER_HECTARE", "label": "ticks per hectare", "dimension": "COUNT_PER_AREA"}],
    "test_result": [{"id": "DETECTED", "label": "Detected"}, {"id": "NOT_DETECTED", "label": "Not detected"}],
    "quality_flag": [{"id": "SAMPLING_IMPRACTICAL", "label": "Sampling impractical"}, {"id": "LEGACY_DATA", "label": "Legacy data"}, {"id": "IDENTIFICATION_LAB_COUNT_SUBSAMPLE", "label": "Identification-laboratory count is a subsample of the total field larvae"}, {"id": "FIELD_IDENTIFICATION_COUNT_DISCREPANCY_OVER_25_PERCENT", "label": "Field and identification-laboratory count discrepancy exceeds 25 percent"}]
  },
  "mappings": [
    {"rule_id": "TAXON_CDC_SCAPULARIS_V1", "field": "tick_taxon", "source_value": "Ixodes_scapularis", "canonical_id": "IXODES_SCAPULARIS", "canonical_label": "Ixodes scapularis", "status": "APPROVED", "source_context": {"publisher": "CDC ArboNET Tick Module", "dataset_id": "cdc-ixodes-county-status-2025", "source_version": "2025"}},
    {"rule_id": "TAXON_CDC_PACIFICUS_V1", "field": "tick_taxon", "source_value": "Ixodes_pacificus", "canonical_id": "IXODES_PACIFICUS", "canonical_label": "Ixodes pacificus", "status": "APPROVED", "source_context": {"publisher": "CDC ArboNET Tick Module", "dataset_id": "cdc-ixodes-county-status-2025", "source_version": "2025"}},
    {"rule_id": "TAXON_NEON_SCAPULARIS_V1", "field": "tick_taxon", "source_value": "Ixodes scapularis", "canonical_id": "IXODES_SCAPULARIS", "canonical_label": "Ixodes scapularis", "status": "APPROVED", "source_context": {"publisher": "NSF NEON", "dataset_id": "DP1.10093.001", "source_version": "RELEASE-2026"}},
    {"rule_id": "TAXON_NEON_PACIFICUS_V1", "field": "tick_taxon", "source_value": "Ixodes pacificus", "canonical_id": "IXODES_PACIFICUS", "canonical_label": "Ixodes pacificus", "status": "APPROVED", "source_context": {"publisher": "NSF NEON", "dataset_id": "DP1.10093.001", "source_version": "RELEASE-2026"}},
    {"rule_id": "TAXON_NEON_AMERICANUM_V1", "field": "tick_taxon", "source_value": "Amblyomma americanum", "canonical_id": "AMBLYOMMA_AMERICANUM", "canonical_label": "Amblyomma americanum", "status": "APPROVED", "source_context": {"publisher": "NSF NEON", "dataset_id": "DP1.10093.001", "source_version": "RELEASE-2026"}},
    {"rule_id": "TAXON_CDC_AGGREGATE_V1", "field": "tick_taxon", "source_value": "Ixodes scapularis or Ixodes pacificus", "canonical_id": "IXODES_SCAPULARIS_OR_PACIFICUS", "canonical_label": "Ixodes scapularis or Ixodes pacificus", "status": "APPROVED", "source_context": {"publisher": "CDC ArboNET Tick Module", "dataset_id": "cdc-ixodes-pathogen-status-2025", "source_version": "2025"}},
    {"rule_id": "LIFE_STAGE_NEON_NYMPH_V1", "field": "life_stage", "source_value": "nymph", "canonical_id": "NYMPH", "canonical_label": "Nymph", "status": "APPROVED", "source_context": {"publisher": "NSF NEON", "dataset_id": "DP1.10093.001", "source_version": "RELEASE-2026"}},
    {"rule_id": "LIFE_STAGE_NEON_NYMPH_CAPITALIZED_V1", "field": "life_stage", "source_value": "Nymph", "canonical_id": "NYMPH", "canonical_label": "Nymph", "status": "APPROVED", "source_context": {"publisher": "NSF NEON", "dataset_id": "DP1.10093.001", "source_version": "RELEASE-2026"}},
    {"rule_id": "METHOD_NEON_DRAG_V1", "field": "collection_method", "source_value": "drag", "canonical_id": "DRAG_CLOTH", "canonical_label": "Drag cloth", "status": "APPROVED", "source_context": {"publisher": "NSF NEON", "dataset_id": "DP1.10093.001", "source_version": "RELEASE-2026"}},
    {"rule_id": "METHOD_NEON_FLAG_V1", "field": "collection_method", "source_value": "flag", "canonical_id": "FLAG_CLOTH", "canonical_label": "Flag cloth", "status": "APPROVED", "source_context": {"publisher": "NSF NEON", "dataset_id": "DP1.10093.001", "source_version": "RELEASE-2026"}},
    {"rule_id": "EFFORT_NEON_SQUARE_METRE_V1", "field": "effort_unit", "source_value": "m2", "canonical_id": "SQUARE_METRE", "canonical_label": "square metre", "status": "APPROVED", "source_context": {"publisher": "NSF NEON", "dataset_id": "DP1.10093.001", "source_version": "RELEASE-2026"}},
    {"rule_id": "RESULT_NEON_POSITIVE_V1", "field": "test_result", "source_value": "positive", "canonical_id": "DETECTED", "canonical_label": "Detected", "status": "APPROVED", "source_context": {"publisher": "NSF NEON", "dataset_id": "DP1.10092.001", "source_version": "RELEASE-2026"}},
    {"rule_id": "RESULT_NEON_NEGATIVE_V1", "field": "test_result", "source_value": "negative", "canonical_id": "NOT_DETECTED", "canonical_label": "Not detected", "status": "APPROVED", "source_context": {"publisher": "NSF NEON", "dataset_id": "DP1.10092.001", "source_version": "RELEASE-2026"}},
    {"rule_id": "QUALITY_NEON_IMPRACTICAL_V1", "field": "quality_flag", "source_value": true, "canonical_id": "SAMPLING_IMPRACTICAL", "canonical_label": "Sampling impractical", "status": "APPROVED", "source_context": {"publisher": "NSF NEON", "dataset_id": "DP1.10093.001", "source_version": "RELEASE-2026"}},
    {"rule_id": "QUALITY_NEON_LEGACY_DATA_V1", "field": "quality_flag", "source_value": "legacyData", "canonical_id": "LEGACY_DATA", "canonical_label": "Legacy data", "status": "APPROVED", "source_context": {"publisher": "NSF NEON", "dataset_id": "DP1.10093.001", "source_version": "RELEASE-2026"}},
    {"rule_id": "QUALITY_NEON_LARVAL_SUBSAMPLE_V1", "field": "quality_flag", "source_value": "ID lab count subsample of total field larvae", "canonical_id": "IDENTIFICATION_LAB_COUNT_SUBSAMPLE", "canonical_label": "Identification-laboratory count is a subsample of the total field larvae", "status": "APPROVED", "source_context": {"publisher": "NSF NEON", "dataset_id": "DP1.10093.001", "source_version": "RELEASE-2026"}},
    {"rule_id": "QUALITY_NEON_COUNT_DISCREPANCY_V1", "field": "quality_flag", "source_value": "field/ID lab larva/nymph/adult count higher than field/ID lab (PDE >25%)", "canonical_id": "FIELD_IDENTIFICATION_COUNT_DISCREPANCY_OVER_25_PERCENT", "canonical_label": "Field and identification-laboratory count discrepancy exceeds 25 percent", "status": "APPROVED", "source_context": {"publisher": "NSF NEON", "dataset_id": "DP1.10093.001", "source_version": "RELEASE-2026"}},
    {"rule_id": "PATHOGEN_CDC_BBURG_V1", "field": "pathogen_target", "source_value": "Borrelia_burgdorferi_sensu_stricto", "canonical_id": "BORRELIA_BURGDORFERI_SENSU_STRICTO", "canonical_label": "Borrelia burgdorferi sensu stricto", "status": "APPROVED", "source_context": {"publisher": "CDC ArboNET Tick Module", "dataset_id": "cdc-ixodes-pathogen-status-2025", "source_version": "2025"}},
    {"rule_id": "PATHOGEN_CDC_BMAYONII_V1", "field": "pathogen_target", "source_value": "Borrelia_mayonii", "canonical_id": "BORRELIA_MAYONII", "canonical_label": "Borrelia mayonii", "status": "APPROVED", "source_context": {"publisher": "CDC ArboNET Tick Module", "dataset_id": "cdc-ixodes-pathogen-status-2025", "source_version": "2025"}},